{
    "$schema": "/data/artifacts/.assets/schemas/ai_main_schema.json",
    "schema_version": "v12",
    "ai_project_name": "project_name_83481_shared",
    "display_name": "Head Gestures",
    "description": "Classification of head gestures such as other, nod and shake using the MLC.\n\nWith this example, you can recognize head gestures such as nodding, shaking, and other general head movements, for applications that might involve safety helmets, VR headsets, and other forms of gear worn on the head. Since recognition can be position-dependent, you can clone this project, collect new data and retrain the model to fit it to your use case. To use this example, ensure that the board is placed firmly above the user's right ear vertically, with the USB port facing down toward the ear, and the LEDs and logos facing outward.",
    "type": "entertainment",
    "uuid": "27a8606c-13ea-4b9d-8bdc-b78206b82a0f",
    "version": "1.0.0",
    "creation_time": "2026-05-11 13:30:04.539435",
    "last_update_time": "2026-05-11 13:30:04.539435",
    "project_owner_uuid": "7b9982b1-b4fe-455f-a776-ef65c061bee8",
    "models": [
        {
            "uuid": "9dc0410a-96ce-4b9c-8a33-015e686e273c",
            "name": "head_gestures_on_steval_mkboxpro",
            "description": "Model to recognize head gestures, with an Auto-ML based approach.",
            "creation_time": "2026-05-11 13:30:04.539451",
            "last_update_time": "2026-05-11 13:30:04.539456",
            "model_owner_uuid": "7b9982b1-b4fe-455f-a776-ef65c061bee8",
            "metadata": {
                "type": "classifier",
                "classes": [
                    "other",
                    "nod",
                    "shake"
                ]
            },
            "dataset": {
                "dataset_id": "01krbkp1f0dfpx5p6wqbk8cd14",
                "name": "head_gestures_on_steval_mkboxpro"
            },
            "target": {
                "type": "mlc",
                "component": "lsm6dsv16x",
                "device": "steval-mkboxpro"
            },
            "data_sufficiency": {
                "creation_time": null,
                "last_update_time": null,
                "runtime": {
                    "type": "job",
                    "jobs": [
                        {
                            "name": "mlctools-ds-job",
                            "version": null,
                            "template_id": null
                        }
                    ]
                },
                "configuration": null,
                "artifacts": [
                    "activities_training.json",
                    "counts.json",
                    "feat_names.json",
                    "kmeans_cluster_labels.json",
                    "lda.onnx",
                    "my_kmeans.json",
                    "my_tree.onnx",
                    "window_size_odr_channels.json"
                ],
                "reports": []
            },
            "training": {
                "creation_time": null,
                "last_update_time": null,
                "runtime": {
                    "type": "job",
                    "jobs": [
                        {
                            "name": "mlctools-job",
                            "version": null,
                            "template_id": null
                        }
                    ]
                },
                "configuration": "configuration.json",
                "artifacts": [
                    "lsm6dsv16x_mlc.json",
                    "lsm6dsv16x_mlc.h"
                ],
                "reports": [
                    "report.json"
                ]
            },
            "codegen": null,
            "building": null
        }
    ],
    "applications": [
        {
            "uuid": "b4bbb461-2b84-465a-bcb8-a1b401c1576a",
            "type": "gateway",
            "device_template_uri": "/e2e_systems/gateway/dtmi/appconfig/gateway/MLC_Gateway-8.expanded.json",
            "device_template_id": "dtmi:appconfig:gateway:MLC_Gateway;8",
            "device_manifest_uri": "/e2e_systems/gateway/dtmi/appconfig/gateway/MLC_Gateway-8.1.manifest.arm64v8.json",
            "image_uri": "/e2e_systems/gateway/images/raspberrypi/staiotcraft_rpi_gateway_1_5_0.img.gz",
            "module_id": "edgeMLC"
        },
        {
            "uuid": "9cb6b114-ccb1-420f-bcc7-41b6085892fc",
            "type": "datalogging",
            "device_template_uri": "/dtmi/appconfig/steval_mkboxpro/FP_SNS_DATALOG2_Datalog2-8.expanded.json",
            "device_template_id": "dtmi:appconfig:steval_mkboxpro:FP_SNS_DATALOG2_Datalog2;8",
            "binary_uri": "/usb/bin/steval-mkboxpro/FP-SNS-DATALOG2_Datalog2_3_2_0.bin",
            "binary_id": 451,
            "protocol": 2
        },
        {
            "uuid": "1674b250-8c15-4409-90bf-6769a7a0b32f",
            "type": "datalogging",
            "device_template_uri": "/dtmi/appconfig/steval_mkboxpro/STAIOTCRAFT_SDATALOG-1.expanded.json",
            "device_template_id": "dtmi:appconfig:steval_mkboxpro:STAIOTCRAFT_SDATALOG;1",
            "binary_uri": "/usb/bin/steval-mkboxpro/STAIOTCRAFT_SDATALOG_1_0_0.bin",
            "binary_id": 517,
            "protocol": 2
        },
        {
            "uuid": "77c61b14-efdd-460d-946b-06049469066b",
            "type": "datalogging",
            "device_template_uri": "/dtmi/appconfig/steval_mkboxpro/STAIOTCRAFT_SDATALOG_RUST-1.expanded.json",
            "device_template_id": "dtmi:appconfig:steval_mkboxpro:STAIOTCRAFT_SDATALOG_RUST;1",
            "binary_uri": "/usb/bin/steval-mkboxpro/STAIOTCRAFT_SDATALOG_RUST_1_0_0.bin",
            "binary_id": 516,
            "protocol": 2
        },
        {
            "uuid": "11a1db1e-3a44-44a7-a33c-3bf2795093ef",
            "type": "inference",
            "device_template_uri": "/dtmi/appconfig/steval_mkboxpro/STAIOTCRAFT_AI_Inertial-1.expanded.json",
            "device_template_id": "dtmi:appconfig:steval_mkboxpro:STAIOTCRAFT_AI_Inertial;1",
            "binary_uri": "/usb/bin/steval-mkboxpro/STAIOTCRAFT_AI_Inertial_1_2_0.bin",
            "binary_id": 484,
            "protocol": 1
        },
        {
            "uuid": "390938ac-22b1-4623-aedf-08c05951228c",
            "type": "inference",
            "device_template_uri": "/dtmi/appconfig/steval_mkboxpro/STAIOTCRAFT_AI_SSM-1.expanded.json",
            "device_template_id": "dtmi:appconfig:steval_mkboxpro:STAIOTCRAFT_AI_SSM;1",
            "binary_uri": "/bluestsdkv2/bin/steval-mkboxpro/STAIOTCRAFT_AI_SSM_1_0_0.bin",
            "binary_id": 529,
            "protocol": 0,
            "bluest_v3_payload": {
                "device_id": "0x0D",
                "fw_id": "0x29",
                "payload_id": "0x0001",
                "decoding_schema": [
                    {
                        "component": "lsm6dsv16x_mlc",
                        "telemetry": "label_id",
                        "type": "int8_t"
                    }
                ]
            }
        }
    ],
    "deployments": [
        {
            "uuid": "7eeac224-0d60-4198-b055-035f597b0c1d",
            "display_name": "Head Gestures with SensorTile.box PRO and LSM6DSV16X sensor.",
            "description": "End-to-end system deployment for Head Gestures use case on the SensorTile.box PRO using the LSM6DSV16X sensor.",
            "last_update_time": null,
            "last_deploy_result": null,
            "cloud_params": {
                "type": "azure_iotc",
                "app_url": null
            },
            "gateway": [
                {
                    "device_id": "gateway_0",
                    "display_name": "gateway_0",
                    "gateway_id": null,
                    "description": "Gateway device at position 0.",
                    "application": "2375848c-53bd-481d-9036-da9715fb2012",
                    "wifi_mode": "off"
                }
            ],
            "leaf": [
                {
                    "device_id": "leaf_0",
                    "display_name": "leaf_0",
                    "gateway_id": "gateway_0",
                    "description": "Leaf device at position 0.",
                    "datalogging": {
                        "supported_applications": [
                            "2e90ef11-64fc-4659-a1c4-8427e67d2300",
                            "eef3feea-1c93-4c87-8814-9cb53d9fb9e5"
                        ],
                        "application": "2e90ef11-64fc-4659-a1c4-8427e67d2300",
                        "firmware_update": false,
                        "models": [
                            {
                                "model_name_reference": "head_gestures_on_steval_mkboxpro"
                            }
                        ]
                    },
                    "inference": {
                        "supported_applications": [
                            "8bdfc9e5-602b-4803-a35a-b1e769837143",
                            "6d5cc65a-d8a4-4d61-8037-e518fd9e8932"
                        ],
                        "application": "8bdfc9e5-602b-4803-a35a-b1e769837143",
                        "firmware_update": false,
                        "models": [
                            {
                                "model_name_reference": "head_gestures_on_steval_mkboxpro",
                                "artifact_type": "json",
                                "component_name": "lsm6dsv16x_mlc"
                            }
                        ]
                    }
                }
            ]
        }
    ]
}