{"$schema": "/data/artifacts/.assets/schemas/ai_main_schema.json", "schema_version": "v11", "ai_project_name": "project_name_210917", "display_name": "Drilling Machine", "description": "Classification of drill actions using the MLC to detect idle, screw, drilling or percussive drilling states.\n\nThis system provides an example of classifying specific actions rather than simple vibrations, enabling the detection of the operating modes of a common household power drill: screwing, drilling, and percussive drilling, or being stationary. Since motion recognition can be very specific, you can clone this project to retrain it and tailor it to a different drill. To use this example, affix the board firmly to the top side of the drill. Keep in mind that vibrations may dislodge the board, and classification accuracy improves the more securely it is attached to the machine.", "type": "industrial", "uuid": "8b94a897-9ccd-4f31-8ae4-31c1784f2890", "version": "1.0.0", "creation_time": "2026-01-20 13:00:14.885113", "last_update_time": "2026-01-20 13:00:14.885113", "project_owner_uuid": "90ab4947-c200-4776-a316-d02c3041c4b8", "models": [{"uuid": "41d06976-6f5d-4554-9299-fc1a62f09fc9", "name": "drilling_machine", "description": "Model to monitor a drill, with an Auto-ML based approach.", "creation_time": "2026-01-20 13:00:14.885124", "last_update_time": "2026-01-20 13:00:14.885130", "model_owner_uuid": "90ab4947-c200-4776-a316-d02c3041c4b8", "metadata": {"type": "classifier", "classes": ["idle", "screwing", "drilling", "percussive_drilling"]}, "dataset": {"dataset_id": "01kfdqv4pn3gkjkefstyj2fvpn", "name": "drilling_machine"}, "target": {"type": "mlc", "component": "ism330dhcx", "device": "steval-stwinbx1"}, "data_sufficiency": {"creation_time": null, "last_update_time": null, "runtime": {"type": "job", "jobs": [{"name": "mlctools-ds-job", "version": null, "template_id": null}]}, "configuration": null, "artifacts": ["activities_training.json", "counts.json", "feat_names.json", "kmeans_cluster_labels.json", "lda.onnx", "my_kmeans.json", "my_tree.onnx", "window_size_odr_channels.json"], "reports": []}, "training": {"creation_time": null, "last_update_time": null, "runtime": {"type": "job", "jobs": [{"name": "mlctools-job", "version": null, "template_id": null}]}, "configuration": "configuration.json", "artifacts": ["ism330dhcx_mlc.json", "ism330dhcx_mlc.h"], "reports": ["report.json"]}, "codegen": null, "building": null}, {"uuid": "5f7a690e-8d8f-4f72-94fb-79631c9a1f10", "name": "drilling_machine_on_stwin", "description": "Model to monitor a drill, with an Auto-ML based approach.", "creation_time": "2026-01-20 13:00:14.885127", "last_update_time": "2026-01-20 13:00:14.885133", "model_owner_uuid": "90ab4947-c200-4776-a316-d02c3041c4b8", "metadata": {"type": "classifier", "classes": ["idle", "screwing", "drilling", "percussive_drilling"]}, "dataset": {"dataset_id": "01kfdqv63sez1q9d0gd3kh17ep", "name": "drilling_machine_on_stwin"}, "target": {"type": "mlc", "component": "ism330dhcx", "device": "steval-stwinkt1b"}, "data_sufficiency": {"creation_time": null, "last_update_time": null, "runtime": {"type": "job", "jobs": [{"name": "mlctools-ds-job", "version": null, "template_id": null}]}, "configuration": null, "artifacts": ["activities_training.json", "counts.json", "feat_names.json", "hnne.pkl", "kmeans_cluster_labels.json", "my_kmeans.json", "my_tree.onnx", "window_size_odr_channels.json"], "reports": []}, "training": {"creation_time": null, "last_update_time": null, "runtime": {"type": "job", "jobs": [{"name": "mlctools-job", "version": null, "template_id": null}]}, "configuration": "configuration.json", "artifacts": ["ism330dhcx_mlc.json", "ism330dhcx_mlc.h"], "reports": ["report.json"]}, "codegen": null, "building": null}], "applications": [{"uuid": "7a00cc99-d1d8-455d-a331-9d281c7d08fa", "type": "gateway", "device_template_uri": "/e2e_systems/gateway/dtmi/appconfig/gateway/MLC_Gateway-8.expanded.json", "device_template_id": "dtmi:appconfig:gateway:MLC_Gateway;8", "device_manifest_uri": "/e2e_systems/gateway/dtmi/appconfig/gateway/MLC_Gateway-8.1.manifest.arm64v8.json", "image_uri": "/e2e_systems/gateway/images/raspberrypi/staiotcraft_rpi_gateway_1_5_0.img.gz", "module_id": "edgeMLC"}, {"uuid": "c47c3a26-350c-4c95-9146-d7d1cd69b4df", "type": "datalogging", "device_template_uri": "/dtmi/appconfig/steval_stwinbx1/FP_SNS_DATALOG2_Datalog2-9.expanded.json", "device_template_id": "dtmi:appconfig:steval_stwinbx1:FP_SNS_DATALOG2_Datalog2;9", "binary_uri": "/bluestsdkv2/bin/steval-stwinbx1/FP-SNS-DATALOG2_Datalog2_3_1_0.bin", "binary_id": 379, "protocol": 2}, {"uuid": "17c90646-ed0e-460d-b6bb-d531c0e2a368", "type": "inference", "device_template_uri": "/dtmi/appconfig/steval_stwinbx1/FP_SNS_STAIOTCFT_AI_Inertial-1.expanded.json", "device_template_id": "dtmi:appconfig:steval_stwinbx1:FP_SNS_STAIOTCFT_AI_Inertial;1", "binary_uri": "/usb/bin/steval-stwinbx1/FP-SNS-STAIOTCFT_AI_Inertial_VibrationMonitoringOnMLC_1_0_0.bin", "binary_id": 424, "protocol": 1}, {"uuid": "e3760694-9e18-4977-8a8d-d21fcaf1c0ec", "type": "datalogging", "device_template_uri": "/dtmi/appconfig/steval_stwinkt1b/FP_SNS_DATALOG2_Datalog2-4.expanded.json", "device_template_id": "dtmi:appconfig:steval_stwinkt1b:FP_SNS_DATALOG2_Datalog2;4", "binary_uri": "/bluestsdkv2/bin/steval-stwinkt1b/FP-SNS-DATALOG2_Datalog2_3_1_0.bin", "binary_id": 380, "protocol": 2}, {"uuid": "7500c232-f332-4094-8a90-bef7bebc55ef", "type": "inference", "device_template_uri": "/dtmi/appconfig/steval_stwinkt1b/FP_SNS_STAIOTCFT_AI_Inertial-1.expanded.json", "device_template_id": "dtmi:appconfig:steval_stwinkt1b:FP_SNS_STAIOTCFT_AI_Inertial;1", "binary_uri": "/usb/bin/steval-stwinkt1b/FP-SNS-STAIOTCFT_AI_Inertial_VibrationMonitoringOnMLC_1_0_0.bin", "binary_id": 426, "protocol": 1}], "deployments": [{"uuid": "287587bf-86ce-4242-bf1e-999f0f02b31b", "display_name": "Drilling Machine monitoring with STWIN.box and ISM330DHCX sensor.", "description": "End-to-end system deployment for Drilling Machine monitoring use case on the STWIN.box using the ISM330DHCX sensor.", "last_update_time": null, "last_deploy_result": null, "cloud_params": {"type": "azure_iotc", "app_url": null}, "gateway": [{"device_id": "gateway_0", "display_name": "gateway_0", "gateway_id": null, "description": "Gateway device at position 0.", "application": "38955195-ff61-410a-9014-770b4e24dcf7", "wifi_mode": "off"}], "leaf": [{"device_id": "leaf_0", "display_name": "leaf_0", "gateway_id": "gateway_0", "description": "Leaf device at position 0.", "datalogging": {"supported_applications": ["6bcc1fd7-11d4-4f77-95fb-d124ce83ee41"], "application": "6bcc1fd7-11d4-4f77-95fb-d124ce83ee41", "firmware_update": false}, "inference": {"supported_applications": ["dbec9cb6-7111-416a-a143-b98ae35a73bd"], "application": "dbec9cb6-7111-416a-a143-b98ae35a73bd", "firmware_update": false, "models": [{"model_name_reference": "drilling_machine", "artifact_type": "json", "component_name": "ism330dhcx_mlc"}]}}]}, {"uuid": "c21e112d-7ca0-4f5d-b405-229d0ba8326a", "display_name": "Drilling Machine monitoring with STWIN and ISM330DHCX sensor.", "description": "End-to-end system deployment for Drilling Machine monitoring use case on the STWIN using the ISM330DHCX sensor.", "last_update_time": null, "last_deploy_result": null, "cloud_params": {"type": "azure_iotc", "app_url": null}, "gateway": [{"device_id": "gateway_0", "display_name": "gateway_0", "gateway_id": null, "description": "Gateway device at position 0.", "application": "38955195-ff61-410a-9014-770b4e24dcf7", "wifi_mode": "off"}], "leaf": [{"device_id": "leaf_0", "display_name": "leaf_0", "gateway_id": "gateway_0", "description": "Leaf device at position 0.", "datalogging": {"supported_applications": ["efd5ae79-5905-4c08-b92c-9d21dcd5966a"], "application": "efd5ae79-5905-4c08-b92c-9d21dcd5966a", "firmware_update": false}, "inference": {"supported_applications": ["efd5ae79-5905-4c08-b92c-9d21dcd5966a"], "application": "ae4293c0-c698-4ab9-bd11-18aba7dad8b0", "firmware_update": false, "models": [{"model_name_reference": "drilling_machine_on_stwin", "artifact_type": "json", "component_name": "ism330dhcx_mlc"}]}}]}]}