{"$schema": "/data/artifacts/.assets/schemas/ai_main_schema.json", "schema_version": "v11", "ai_project_name": "iot_test", "display_name": "Smart Asset Tracking", "description": "Classification of package conditions using the MLC to detect stationary orientation (upright or not) or moving and shaking states.\n\nWith this example, you can individually track the state of a physical item, such as a package, to monitor whether it is moving or being shaken too harshly, and whether it is still upright or not. Classification detects even brief events. You can clone and retrain the model to adapt classes to your use case, for example by tailoring the 'shaken' class to particularly strong motion or, conversely, by making it more sensitive for fragile items. To use this example, simply position the board on top of the item, ensuring it is secured firmly.", "type": "industrial", "uuid": "076aa6f0-d0ce-418b-b808-86025310f760", "version": "1.0.0", "creation_time": "2025-10-22 13:28:25.087002", "last_update_time": "2025-10-22 13:28:25.087002", "project_owner_uuid": "af0d582a-eb60-4813-a53b-d03ea5ba52b4", "models": [{"uuid": "2eb01977-743f-4b68-bc4a-47461573bfc7", "name": "smart_asset_tracking", "description": "Model to recognize position and orientation of a tracked item, with an Auto-ML based approach.", "creation_time": "2025-10-22 13:28:25.087016", "last_update_time": "2025-10-22 13:28:25.087018", "model_owner_uuid": "af0d582a-eb60-4813-a53b-d03ea5ba52b4", "metadata": {"type": "classifier", "classes": ["stationary_upright", "stationary_not_upright", "motion", "shaken"]}, "dataset": {"dataset_id": "01k861phbffwj29rqy6tmr49t2", "name": "smart_asset_tracking"}, "target": {"type": "mlc", "component": "lsm6dsv16x", "device": "steval-mkboxpro"}, "data_sufficiency": {"creation_time": null, "last_update_time": null, "runtime": {"type": "job", "jobs": [{"name": "mlctools-ds-job", "version": null, "template_id": null}]}, "configuration": null, "artifacts": ["activities_training.json", "counts.json", "feat_names.json", "kmeans_cluster_labels.json", "lda.onnx", "my_kmeans.json", "my_tree.onnx", "window_size_odr_channels.json"], "reports": []}, "training": {"creation_time": null, "last_update_time": null, "runtime": {"type": "job", "jobs": [{"name": "mlctools-job", "version": null, "template_id": null}]}, "configuration": "configuration.json", "artifacts": ["lsm6dsv16x_mlc.json", "lsm6dsv16x_mlc.h"], "reports": ["report.json"]}, "codegen": null, "building": null}], "applications": [{"uuid": "879a9320-a336-4d71-8c8c-476754ff2b02", "type": "gateway", "device_template_uri": "/e2e_systems/gateway/dtmi/appconfig/gateway/MLC_Gateway-8.expanded.json", "device_template_id": "dtmi:appconfig:gateway:MLC_Gateway;8", "device_manifest_uri": "/e2e_systems/gateway/dtmi/appconfig/gateway/MLC_Gateway-8.1.manifest.arm64v8.json", "image_uri": "/e2e_systems/gateway/images/raspberrypi/staiotcraft_rpi_gateway_1_5_0.img.gz", "module_id": "edgeMLC"}, {"uuid": "61458a86-3718-46fb-b124-f1a8db93f105", "type": "datalogging", "device_template_uri": "/dtmi/appconfig/steval_mkboxpro/FP_SNS_DATALOG2_Datalog2-7.expanded.json", "device_template_id": "dtmi:appconfig:steval_mkboxpro:FP_SNS_DATALOG2_Datalog2;7", "binary_uri": "/bluestsdkv2/bin/steval-mkboxpro/FP-SNS-DATALOG2_Datalog2_3_1_0.bin", "binary_id": 381, "protocol": 2}, {"uuid": "44a66ae2-6071-46ed-8e27-f6fe52c9a682", "type": "inference", "device_template_uri": "/dtmi/appconfig/steval_mkboxpro/FP_SNS_STAIOTCFT_AI_Inertial-1.expanded.json", "device_template_id": "dtmi:appconfig:steval_mkboxpro:FP_SNS_STAIOTCFT_AI_Inertial;1", "binary_uri": "/usb/bin/steval-mkboxpro/FP-SNS-STAIOTCFT_AI_Inertial_AssetTrackingOnMLC_1_0_0.bin", "binary_id": 418, "protocol": 1}, {"uuid": "4b228db3-97cb-42fb-b7d4-1797876adbdf", "type": "inference", "device_template_uri": "/dtmi/appconfig/steval_mkboxpro/AI_SSM-1.expanded.json", "device_template_id": "dtmi:appconfig:steval_mkboxpro:AI_SSM;1", "binary_uri": "/bluestsdkv2/bin/steval-mkboxpro/AI-SSM_1_0_0.bin", "binary_id": 438, "protocol": 0, "bluest_v3_payload": {"device_id": "0x0D", "fw_id": "0x25", "payload_id": "0x0001", "decoding_schema": [{"component": "lsm6dsv16x_mlc", "telemetry": "label_id", "type": "int8"}]}}], "deployments": [{"uuid": "60d48117-765f-470d-9d99-6ab7b35f9d8b", "display_name": "Smart Asset Tracking with SensorTile.box PRO and LSM6DSV16X sensor.", "description": "End-to-end system deployment for Smart Asset Tracking use case on the SensorTile.box PRO using the LSM6DSV16X sensor.", "last_update_time": "2025-10-22 13:35:41.237392", "last_deploy_result": null, "cloud_params": {"type": "azure_iotc", "app_url": null}, "gateway": [{"device_id": "267eae6b-7699-4cd0-8c74-797c601a64bd", "display_name": "gateway_0", "gateway_id": null, "description": "Gateway device at position 0.", "application": "879a9320-a336-4d71-8c8c-476754ff2b02", "wifi_mode": "off"}], "leaf": [{"device_id": "09e10d0c-be07-4de4-8db8-7e173212e363", "display_name": "leaf_0", "gateway_id": "gateway_0", "description": "Leaf device at position 0.", "datalogging": {"supported_applications": ["61458a86-3718-46fb-b124-f1a8db93f105"], "application": "61458a86-3718-46fb-b124-f1a8db93f105", "firmware_update": false}, "inference": {"supported_applications": ["44a66ae2-6071-46ed-8e27-f6fe52c9a682", "4b228db3-97cb-42fb-b7d4-1797876adbdf"], "application": "4b228db3-97cb-42fb-b7d4-1797876adbdf", "firmware_update": false, "models": [{"model_name_reference": "smart_asset_tracking", "artifact_type": "json", "component_name": "lsm6dsv16x_mlc"}]}}]}]}