{"$schema": "/data/artifacts/.assets/schemas/ai_main_schema.json", "schema_version": "v11", "ai_project_name": "project_name_594615-shared", "display_name": "Tennis Activity Recognition", "description": "Classification of tennis shots using the MLC, including forehand, backhand, slice-forehand, slice-backhand, and serve strokes.\n\nThis example leverages both the accelerometer and the gyroscope sensors to better detect the movements. To use this example effectively, plug the DIL24 extension onto the board and place the board on the outside of the right wrist and secure it firmly. Make sure it is oriented in such a way that the two buttons are facing toward your shoulder, with the LEDs and logos visible and facing outward. In case you need a different placement on the wrist or want to add some more movements of your own, just clone the project into your workspace, collect a new dataset, and retrain the model.", "type": "entertainment", "uuid": "44353616-27b6-444b-85c2-fec189e015ca", "version": "1.0.0", "creation_time": "2026-01-21 09:38:31.209833", "last_update_time": "2026-01-21 09:38:31.209833", "project_owner_uuid": "90ab4947-c200-4776-a316-d02c3041c4b8", "models": [{"uuid": "0a9a7b3c-e3ee-4383-822f-55ced1304545", "name": "tennis_activity_recognition_80x", "description": "Model to recognize tennis shots, with an Auto-ML based approach.", "creation_time": "2026-01-21 09:38:31.209846", "last_update_time": "2026-01-21 09:38:31.209850", "model_owner_uuid": "90ab4947-c200-4776-a316-d02c3041c4b8", "metadata": {"type": "classifier", "classes": ["no_shot", "serve", "backhand_slice", "forehand_slice", "backhand", "forehand"]}, "dataset": {"dataset_id": "01kffypmmg0cdj9xmv53vp2zaa", "name": "tennis_activity_80x"}, "target": {"type": "mlc", "component": "lsm6dsv80x", "device": "steval-mkboxpro"}, "data_sufficiency": null, "training": {"creation_time": null, "last_update_time": null, "runtime": {"type": "job", "jobs": [{"name": "mlctools-job", "version": null, "template_id": null}]}, "configuration": "configuration.json", "artifacts": ["lsm6dsv80x_mlc.json", "lsm6dsv80x_mlc.h"], "reports": ["report.json"]}, "codegen": null, "building": null}, {"uuid": "fabe56ec-22f5-4096-98f7-ca315a0ff1f8", "name": "tennis_activity_recognition_320x", "description": "Model to recognize tennis shots, with an Auto-ML based approach.", "creation_time": "2026-01-21 09:38:31.209848", "last_update_time": "2026-01-21 09:38:31.209852", "model_owner_uuid": "90ab4947-c200-4776-a316-d02c3041c4b8", "metadata": {"type": "classifier", "classes": ["no_shot", "serve", "backhand_slice", "forehand_slice", "backhand", "forehand"]}, "dataset": {"dataset_id": "01kffypp0mr9xa3gx8g2xhymx8", "name": "tennis_activity_320"}, "target": {"type": "mlc", "component": "lsm6dsv320x", "device": "steval-mkboxpro"}, "data_sufficiency": null, "training": {"creation_time": null, "last_update_time": null, "runtime": {"type": "job", "jobs": [{"name": "mlctools-job", "version": null, "template_id": null}]}, "configuration": "configuration.json", "artifacts": ["lsm6dsv320x_mlc.json", "lsm6dsv320x_mlc.h"], "reports": ["report.json"]}, "codegen": null, "building": null}], "applications": [{"uuid": "cfe6a582-8206-4983-9e2b-cec4740c6240", "type": "gateway", "device_template_uri": "/e2e_systems/gateway/dtmi/appconfig/gateway/MLC_Gateway-8.expanded.json", "device_template_id": "dtmi:appconfig:gateway:MLC_Gateway;8", "device_manifest_uri": "/e2e_systems/gateway/dtmi/appconfig/gateway/MLC_Gateway-8.1.manifest.arm64v8.json", "image_uri": "/e2e_systems/gateway/images/raspberrypi/staiotcraft_rpi_gateway_1_5_0.img.gz", "module_id": "edgeMLC"}, {"uuid": "1840a3e3-888c-48b2-92a0-a721fffbd613", "type": "datalogging", "device_template_uri": "/dtmi/appconfig/steval_mkboxpro/FP_SNS_DATALOG2_Datalog2-7.expanded.json", "device_template_id": "dtmi:appconfig:steval_mkboxpro:FP_SNS_DATALOG2_Datalog2;7", "binary_uri": "/bluestsdkv2/bin/steval-mkboxpro/FP-SNS-DATALOG2_Datalog2_3_1_0.bin", "binary_id": 381, "protocol": 2}, {"uuid": "1537b6cf-1794-4fd8-bf54-6b167c1e954d", "type": "inference", "device_template_uri": "/dtmi/appconfig/steval_mkboxpro/FP_SNS_STAIOTCFT_AI_Inertial-1.expanded.json", "device_template_id": "dtmi:appconfig:steval_mkboxpro:FP_SNS_STAIOTCFT_AI_Inertial;1", "binary_uri": "/usb/bin/steval-mkboxpro/FP-SNS-STAIOTCFT_AI_Inertial_AssetTrackingOnMLC_1_0_0.bin", "binary_id": 418, "protocol": 1}, {"uuid": "00c548f2-ffc1-4a70-a26b-1f3b61f3ff49", "type": "inference", "device_template_uri": "/dtmi/appconfig/steval_mkboxpro/AI_SSM-1.expanded.json", "device_template_id": "dtmi:appconfig:steval_mkboxpro:AI_SSM;1", "binary_uri": "/bluestsdkv2/bin/steval-mkboxpro/AI-SSM_1_0_0.bin", "binary_id": 438, "protocol": 0, "bluest_v3_payload": {"device_id": "0x0D", "fw_id": "0x25", "payload_id": "0x0001", "description": "Environmental Monitor", "decoding_schema": [{"component": "lsm6dsv16x_mlc", "telemetry": "label_id", "type": "int8_t"}]}}], "deployments": [{"uuid": "46e31a4e-6757-44cc-b674-d748ba5f52f6", "display_name": "Tennis Activity Recognition with SensorTile.box PRO and LSM6DSV80X sensor.", "description": "End-to-end system deployment for Tennis Activity Recognition use case on the SensorTile.box PRO using the LSM6DSV80X sensor.", "last_update_time": null, "last_deploy_result": null, "cloud_params": {"type": "azure_iotc", "app_url": null}, "gateway": [{"device_id": "gateway_0", "display_name": "gateway_0", "gateway_id": null, "description": "Gateway device at position 0.", "application": "2e3d92ca-c14a-4e9b-b270-50101a6151f9", "wifi_mode": "off"}], "leaf": [{"device_id": "leaf_0", "display_name": "leaf_0", "gateway_id": "gateway_0", "description": "Leaf device at position 0.", "datalogging": {"supported_applications": ["c442efda-6860-4299-8c13-0872745a065c"], "application": "c442efda-6860-4299-8c13-0872745a065c", "firmware_update": false}, "inference": {"supported_applications": ["32eee0f5-3db9-4660-8734-3cd9c8646cf8", "ba3ab86c-7e83-43c2-83aa-74f1b42f6838"], "application": "32eee0f5-3db9-4660-8734-3cd9c8646cf8", "firmware_update": false, "models": [{"model_name_reference": "tennis_activity_recognition_80x", "artifact_type": "json", "component_name": "lsm6dsv16x_mlc"}]}}]}, {"uuid": "abfac9a9-3319-4039-8a71-aa4e647c453b", "display_name": "Tennis Activity Recognition with SensorTile.box PRO and LSM6DSV320X sensor.", "description": "End-to-end system deployment for Tennis Activity Recognition use case on the SensorTile.box PRO using the LSM6DSV320X sensor.", "last_update_time": null, "last_deploy_result": null, "cloud_params": {"type": "azure_iotc", "app_url": null}, "gateway": [{"device_id": "gateway_0", "display_name": "gateway_0", "gateway_id": null, "description": "Gateway device at position 0.", "application": "2e3d92ca-c14a-4e9b-b270-50101a6151f9", "wifi_mode": "off"}], "leaf": [{"device_id": "leaf_0", "display_name": "leaf_0", "gateway_id": "gateway_0", "description": "Leaf device at position 0.", "datalogging": {"supported_applications": ["c442efda-6860-4299-8c13-0872745a065c"], "application": "c442efda-6860-4299-8c13-0872745a065c", "firmware_update": false}, "inference": {"supported_applications": ["32eee0f5-3db9-4660-8734-3cd9c8646cf8", "ba3ab86c-7e83-43c2-83aa-74f1b42f6838"], "application": "32eee0f5-3db9-4660-8734-3cd9c8646cf8", "firmware_update": false, "models": [{"model_name_reference": "tennis_activity_recognition_320x", "artifact_type": "json", "component_name": "lsm6dsv16x_mlc"}]}}]}]}