{
    "$schema": "/data/artifacts/.assets/schemas/ai_main_schema.json",
    "schema_version": "v10",
    "ai_project_name": "test-project-111",
    "display_name": "Smart Asset Tracking",
    "description": "Classification of package conditions using the MLC to detect stationary orientation (upright or not) or moving and shaking states.\n\nWith this example, you can individually track the state of a physical item, such as a package, to monitor whether it is moving or being shaken too harshly, and whether it is still upright or not. Classification is very fast and will detect even brief events. You can also clone and retrain the model to adapt its classes to your use case, for example by tailoring the 'shaken' class to particularly strong motion or, on the contrary, by making it more sensitive for fragile items.\nTo use this example, simply position the board on top of the item, ensuring it is secured firmly. If you wish to avoid using a USB cable, you can also track it wirelessly from the ST AIoT Craft mobile app.",
    "type": "industrial",
    "uuid": "b6fc78ac-73de-4493-9ba6-f51c21d84208",
    "version": "1.0.0",
    "creation_time": "2025-08-20 10:06:31.504549",
    "last_update_time": "2025-08-20 10:06:31.504549",
    "models": [],
    "applications": [
        {
            "uuid": "04ee195d-0528-422c-9825-5cb6b6b096a7",
            "type": "gateway",
            "device_template_uri": "/e2e_systems/gateway/dtmi/appconfig/gateway/MLC_Gateway-7.expanded.json",
            "device_template_id": "dtmi:appconfig:gateway:MLC_Gateway;7",
            "device_manifest_uri": "/e2e_systems/gateway/dtmi/appconfig/gateway/MLC_Gateway-7.2.manifest.arm64v8.json",
            "image_uri": "/e2e_systems/gateway/images/raspberrypi/staiotcraft_rpi_gateway_1_4_0.img.gz",
            "module_id": "edgeMLC"
        },
        {
            "uuid": "59b0ca44-d85b-497d-812f-2cec1832f998",
            "type": "datalogging",
            "device_template_uri": "/dtmi/appconfig/steval_mkboxpro/FP_SNS_DATALOG2_Datalog2-7.expanded.json",
            "device_template_id": "dtmi:appconfig:steval_mkboxpro:FP_SNS_DATALOG2_Datalog2;7",
            "binary_uri": "/bluestsdkv2/bin/steval-mkboxpro/FP-SNS-DATALOG2_Datalog2_3_1_0.bin",
            "binary_id": 381,
            "protocol": 2
        },
        {
            "uuid": "51f18268-b6a2-4488-a392-ff16b9549d9c",
            "type": "inference",
            "device_template_uri": "/dtmi/appconfig/steval_mkboxpro/FP_SNS_STAIOTCFT_AI_Inertial-1.expanded.json",
            "device_template_id": "dtmi:appconfig:steval_mkboxpro:FP_SNS_STAIOTCFT_AI_Inertial;1",
            "binary_uri": "/usb/bin/steval-mkboxpro/FP-SNS-STAIOTCFT_AI_Inertial_AssetTrackingOnMLC_1_0_0.bin",
            "binary_id": 418,
            "protocol": 1
        }
    ],
    "deployments": [
        {
            "uuid": "a56f1c2a-db8b-4e19-9915-789a019893fa",
            "display_name": "Smart Asset Tracking end-to-end system with SensorTile.box PRO.",
            "description": "End-to-end system deployment for Smart Asset Tracking scenario.",
            "last_update_time": null,
            "last_deploy_result": null,
            "cloud_params": {
                "type": "azure_iotc",
                "app_url": null
            },
            "gateway": [
                {
                    "device_id": "gateway_0",
                    "display_name": "gateway_0",
                    "gateway_id": null,
                    "description": "Gateway device at position 0.",
                    "application": "04ee195d-0528-422c-9825-5cb6b6b096a7",
                    "wifi_mode": "off"
                }
            ],
            "leaf": [
                {
                    "device_id": "leaf_0",
                    "display_name": "leaf_0",
                    "gateway_id": "gateway_0",
                    "description": "Leaf device at position 0.",
                    "datalogging": {
                        "application": "59b0ca44-d85b-497d-812f-2cec1832f998",
                        "firmware_update": false
                    },
                    "inference": {
                        "application": "51f18268-b6a2-4488-a392-ff16b9549d9c",
                        "firmware_update": false,
                        "models": [
                            {
                                "model_name_reference": "smart_asset_tracking",
                                "artifact_type": "json",
                                "component_name": "lsm6dsv16x_mlc"
                            }
                        ]
                    }
                }
            ]
        }
    ],
    "project_owner_uuid": "334c65a5-1495-453a-a6de-4d384a781000"
}