{"$schema": "/data/artifacts/.assets/schemas/ai_main_schema.json", "schema_version": "v11", "ai_project_name": "project_name_713720", "display_name": "Head Gestures", "description": "Classification of head gestures such as other, nod and shake using the MLC.\n\nWith this example, you can recognize head gestures such as nodding, shaking, and other general head movements, for applications that might involve safety helmets, VR headsets, and other forms of gear worn on the head. Since recognition can be position-dependent, you can clone this project, collect new data and retrain the model to fit it to your use case. To use this example, ensure that the board is placed firmly above the user's right ear vertically, with the USB port facing down toward the ear, and the LEDs and logos facing outward.", "type": "entertainment", "uuid": "a2021f34-78f1-46c5-9f8d-8182796cb682", "version": "1.0.0", "creation_time": "2026-01-21 09:18:36.171710", "last_update_time": "2026-01-21 09:18:36.171710", "project_owner_uuid": "90ab4947-c200-4776-a316-d02c3041c4b8", "models": [{"uuid": "dcade001-bcfe-4786-a2ca-3e30c819fcbc", "name": "head_gestures", "description": "Model to recognize head gestures, with an Auto-ML based approach.", "creation_time": "2026-01-21 09:18:36.171722", "last_update_time": "2026-01-21 09:18:36.171724", "model_owner_uuid": "90ab4947-c200-4776-a316-d02c3041c4b8", "metadata": {"type": "classifier", "classes": ["other", "nod", "shake"]}, "dataset": {"dataset_id": "01kffxj7xh8ct089qh9f5b7nhv", "name": "head_gestures"}, "target": {"type": "mlc", "component": "lsm6dsv16x", "device": "steval-mkboxpro"}, "data_sufficiency": {"creation_time": null, "last_update_time": null, "runtime": {"type": "job", "jobs": [{"name": "mlctools-ds-job", "version": null, "template_id": null}]}, "configuration": null, "artifacts": ["activities_training.json", "counts.json", "feat_names.json", "kmeans_cluster_labels.json", "lda.onnx", "my_kmeans.json", "my_tree.onnx", "window_size_odr_channels.json"], "reports": []}, "training": {"creation_time": null, "last_update_time": null, "runtime": {"type": "job", "jobs": [{"name": "mlctools-job", "version": null, "template_id": null}]}, "configuration": "configuration.json", "artifacts": ["lsm6dsv16x_mlc.json", "lsm6dsv16x_mlc.h"], "reports": ["report.json"]}, "codegen": null, "building": null}], "applications": [{"uuid": "73e81c9b-538f-4620-8877-11dec8dca191", "type": "gateway", "device_template_uri": "/e2e_systems/gateway/dtmi/appconfig/gateway/MLC_Gateway-8.expanded.json", "device_template_id": "dtmi:appconfig:gateway:MLC_Gateway;8", "device_manifest_uri": "/e2e_systems/gateway/dtmi/appconfig/gateway/MLC_Gateway-8.1.manifest.arm64v8.json", "image_uri": "/e2e_systems/gateway/images/raspberrypi/staiotcraft_rpi_gateway_1_5_0.img.gz", "module_id": "edgeMLC"}, {"uuid": "87a68d47-d83d-4f1e-8d2e-7dffa6851ce9", "type": "datalogging", "device_template_uri": "/dtmi/appconfig/steval_mkboxpro/FP_SNS_DATALOG2_Datalog2-7.expanded.json", "device_template_id": "dtmi:appconfig:steval_mkboxpro:FP_SNS_DATALOG2_Datalog2;7", "binary_uri": "/bluestsdkv2/bin/steval-mkboxpro/FP-SNS-DATALOG2_Datalog2_3_1_0.bin", "binary_id": 381, "protocol": 2}, {"uuid": "d34aee97-ff7a-4beb-851a-f59fb6ddae8c", "type": "inference", "device_template_uri": "/dtmi/appconfig/steval_mkboxpro/FP_SNS_STAIOTCFT_AI_Inertial-1.expanded.json", "device_template_id": "dtmi:appconfig:steval_mkboxpro:FP_SNS_STAIOTCFT_AI_Inertial;1", "binary_uri": "/usb/bin/steval-mkboxpro/FP-SNS-STAIOTCFT_AI_Inertial_AssetTrackingOnMLC_1_0_0.bin", "binary_id": 418, "protocol": 1}, {"uuid": "e1784c5e-ee13-4dc5-90d6-f93ae05c7d8a", "type": "inference", "device_template_uri": "/dtmi/appconfig/steval_mkboxpro/AI_SSM-1.expanded.json", "device_template_id": "dtmi:appconfig:steval_mkboxpro:AI_SSM;1", "binary_uri": "/bluestsdkv2/bin/steval-mkboxpro/AI-SSM_1_0_0.bin", "binary_id": 438, "protocol": 0, "bluest_v3_payload": {"device_id": "0x0D", "fw_id": "0x25", "payload_id": "0x0001", "decoding_schema": [{"component": "lsm6dsv16x_mlc", "telemetry": "label_id", "type": "int8_t"}]}}], "deployments": [{"uuid": "85db134f-271a-41ef-adcd-65d0ce468121", "display_name": "Head Gestures with SensorTile.box PRO and LSM6DSV16X sensor.", "description": "End-to-end system deployment for Head Gestures use case on the SensorTile.box PRO using the LSM6DSV16X sensor.", "last_update_time": null, "last_deploy_result": null, "cloud_params": {"type": "azure_iotc", "app_url": null}, "gateway": [{"device_id": "gateway_0", "display_name": "gateway_0", "gateway_id": null, "description": "Gateway device at position 0.", "application": "1f90f38a-23ce-4a4e-9381-c89d206166b8", "wifi_mode": "off"}], "leaf": [{"device_id": "leaf_0", "display_name": "leaf_0", "gateway_id": "gateway_0", "description": "Leaf device at position 0.", "datalogging": {"supported_applications": ["15af1ac4-8144-45a7-b812-3fa89d051658"], "application": "15af1ac4-8144-45a7-b812-3fa89d051658", "firmware_update": false}, "inference": {"supported_applications": ["87526bc5-0e86-47e1-98e3-39d7f04e81f4", "34c9ce30-195c-4367-a2cd-481c2799a53d"], "application": "87526bc5-0e86-47e1-98e3-39d7f04e81f4", "firmware_update": false, "models": [{"model_name_reference": "head_gestures", "artifact_type": "json", "component_name": "lsm6dsv16x_mlc"}]}}]}]}